{
  "schema_version": "p8.project_membership_batch_skill_binding.v1",
  "operation_id": "PROJECT.MEMBERSHIP.ADD_MANY",
  "payload_hash": "sha256:571996c3fab245fd25bd73c8e33ad93266f933045296f792cdb7d10d92d13103",
  "capability_ref": {
    "capability_id": "PROJECT.MEMBERSHIP.ADD_MANY",
    "skill_id": "PROJECT.MEMBERSHIP.ADD_MANY",
    "skill_version": "1.0.0",
    "skill_semantic_hash": "sha256:9a3362e5906cf9d62d720d77369acc6e39d40afcb1f0ccb59726b0ea85e7af02",
    "source_sha256": "sha256:723f5683a4b6a9baa458874878d3b4956ecb259feca9077629c86500a127efe5",
    "artifact_source_revision": "f5d899bb611ee2cd65ce9f6544ed6e51b450b7d4"
  },
  "arguments": {
    "tenant_id": "tenant-demo",
    "requester_subject_id": "subject-chairman",
    "project_id": "11111111-1111-4111-8111-111111111111",
    "target_subject_ids": ["subject-a", "subject-b"],
    "member_role": "MEMBER",
    "resolution_evidence_hash": "sha256:573b130aa3ef95b2cb2c7c7756cc76029ad7fb0f427bff88824060ba3e04eacd"
  },
  "approval_projection": {
    "operation_id": "PROJECT.MEMBERSHIP.ADD_MANY",
    "project_id": "11111111-1111-4111-8111-111111111111",
    "target_subject_ids": ["subject-a", "subject-b"],
    "target_count": 2,
    "rejected_count": 1,
    "member_role": "MEMBER",
    "resolution_evidence_hash": "sha256:573b130aa3ef95b2cb2c7c7756cc76029ad7fb0f427bff88824060ba3e04eacd",
    "payload_hash": "sha256:571996c3fab245fd25bd73c8e33ad93266f933045296f792cdb7d10d92d13103"
  },
  "model_authority": false,
  "binding_hash": "sha256:fdb28b383f807f55197961331445895ef4623379acd77368f8f8cb539b044868"
}
